{
  "caseId": "RWALL-001",
  "schemaVersion": "1.0",
  "provenanceType": "synthetic_engineering_benchmark",
  "snapshotStatus": "Accepted",
  "finalization": {
    "allowed": true,
    "blockingCodes": []
  },
  "modelTotals": {
    "grossConcreteM3": 3.0,
    "openingDeductionM3": 0.0,
    "netConcreteM3": 3.0,
    "unclassifiedVolumeM3": 0.0,
    "steelKg": 102.0986196490147,
    "steelExactKg": 102.0986196490147,
    "steelApproximateKg": 0.0,
    "steelKgBySource": {
      "ProvidedBars": 102.0986196490147,
      "RequiredDesignArea": 0.0,
      "EstimatedRatio": 0.0,
      "ManualOverride": 0.0
    }
  },
  "completeness": {
    "concrete": "Complete",
    "steel": "Complete",
    "concreteUnknownElementIds": [],
    "steelUnknownElementIds": []
  },
  "byStory": {
    "L1": {
      "grossConcreteM3": 3.0,
      "netConcreteM3": 3.0,
      "steelKg": 102.0986196490147
    }
  },
  "byElementType": {
    "Beam": {
      "grossConcreteM3": 0.0,
      "netConcreteM3": 0.0,
      "steelKg": 0.0
    },
    "Column": {
      "grossConcreteM3": 0.0,
      "netConcreteM3": 0.0,
      "steelKg": 0.0
    },
    "Slab": {
      "grossConcreteM3": 0.0,
      "netConcreteM3": 0.0,
      "steelKg": 0.0
    },
    "Wall": {
      "grossConcreteM3": 3.0,
      "netConcreteM3": 3.0,
      "steelKg": 102.0986196490147
    }
  },
  "byMaterial": {
    "C35": {
      "grossConcreteM3": 3.0,
      "netConcreteM3": 3.0
    }
  },
  "steelByMaterial": {
    "B500": 102.0986196490147
  },
  "elements": [
    {
      "id": "W1",
      "occurrence": 0,
      "type": "Wall",
      "story": "L1",
      "materialGroup": "C35",
      "status": "Included",
      "grossConcreteM3": 3.0,
      "netConcreteM3": 3.0,
      "steelKg": 102.0986196490147,
      "reinforcementSource": "ProvidedBars",
      "steelExact": true,
      "steelComponentsKg": [
        65.47628868795508,
        36.622330961059625
      ],
      "grossAreaM2": 15.0,
      "openingAreaSumM2": 0.0,
      "openingDeductedAreaM2": 0.0,
      "netAreaM2": 15.0
    }
  ],
  "warnings": [],
  "tolerance": {
    "volumeM3": 1e-06,
    "areaM2": 1e-06,
    "lengthM": 1e-06,
    "steelKg": 0.001,
    "relative": 1e-09
  },
  "derivation": {
    "method": "independent_first_principles",
    "generator": "quentra_bench",
    "generatorVersion": "1.1.0",
    "handChecks": 2,
    "closedFormCrossCheck": false
  }
}
