{
  "caseId": "FRAME-003",
  "schemaVersion": "1.0",
  "provenanceType": "synthetic_engineering_benchmark",
  "snapshotStatus": "Accepted",
  "finalization": {
    "allowed": true,
    "blockingCodes": []
  },
  "modelTotals": {
    "grossConcreteM3": 0.6872233929727672,
    "openingDeductionM3": 0.0,
    "netConcreteM3": 0.6872233929727672,
    "unclassifiedVolumeM3": 0.0,
    "steelKg": null,
    "steelExactKg": null,
    "steelApproximateKg": null,
    "steelKgBySource": null
  },
  "completeness": {
    "concrete": "Complete",
    "steel": "NotEvaluated",
    "concreteUnknownElementIds": [],
    "steelUnknownElementIds": []
  },
  "byStory": {
    "L1": {
      "grossConcreteM3": 0.6872233929727672,
      "netConcreteM3": 0.6872233929727672,
      "steelKg": null
    }
  },
  "byElementType": {
    "Beam": {
      "grossConcreteM3": 0.0,
      "netConcreteM3": 0.0,
      "steelKg": null
    },
    "Column": {
      "grossConcreteM3": 0.6872233929727672,
      "netConcreteM3": 0.6872233929727672,
      "steelKg": null
    },
    "Slab": {
      "grossConcreteM3": 0.0,
      "netConcreteM3": 0.0,
      "steelKg": null
    },
    "Wall": {
      "grossConcreteM3": 0.0,
      "netConcreteM3": 0.0,
      "steelKg": null
    }
  },
  "byMaterial": {
    "C30": {
      "grossConcreteM3": 0.6872233929727672,
      "netConcreteM3": 0.6872233929727672
    }
  },
  "steelByMaterial": {},
  "elements": [
    {
      "id": "C1",
      "occurrence": 0,
      "type": "Column",
      "story": "L1",
      "materialGroup": "C30",
      "status": "Included",
      "grossConcreteM3": 0.6872233929727672,
      "netConcreteM3": 0.6872233929727672,
      "steelKg": null,
      "reinforcementSource": null,
      "steelExact": null,
      "steelComponentsKg": [],
      "lengthM": 3.5
    }
  ],
  "warnings": [],
  "tolerance": {
    "volumeM3": 1e-06,
    "areaM2": 1e-06,
    "lengthM": 1e-06,
    "steelKg": 0.001,
    "relative": 1e-09
  },
  "derivation": {
    "method": "independent_first_principles",
    "generator": "quentra_bench",
    "generatorVersion": "1.1.0",
    "handChecks": 2,
    "closedFormCrossCheck": false
  }
}
