{
  "caseId": "DUP-007",
  "schemaVersion": "1.0",
  "provenanceType": "synthetic_engineering_benchmark",
  "snapshotStatus": "Accepted",
  "finalization": {
    "allowed": false,
    "blockingCodes": [
      "SLAB_OVERLAP"
    ]
  },
  "modelTotals": {
    "grossConcreteM3": 13.4,
    "openingDeductionM3": 0.0,
    "netConcreteM3": 13.4,
    "unclassifiedVolumeM3": 0.0,
    "steelKg": null,
    "steelExactKg": null,
    "steelApproximateKg": null,
    "steelKgBySource": null
  },
  "completeness": {
    "concrete": "Complete",
    "steel": "NotEvaluated",
    "concreteUnknownElementIds": [],
    "steelUnknownElementIds": []
  },
  "byStory": {
    "L1": {
      "grossConcreteM3": 13.4,
      "netConcreteM3": 13.4,
      "steelKg": null
    }
  },
  "byElementType": {
    "Beam": {
      "grossConcreteM3": 0.0,
      "netConcreteM3": 0.0,
      "steelKg": null
    },
    "Column": {
      "grossConcreteM3": 0.0,
      "netConcreteM3": 0.0,
      "steelKg": null
    },
    "Slab": {
      "grossConcreteM3": 13.4,
      "netConcreteM3": 13.4,
      "steelKg": null
    },
    "Wall": {
      "grossConcreteM3": 0.0,
      "netConcreteM3": 0.0,
      "steelKg": null
    }
  },
  "byMaterial": {
    "C30": {
      "grossConcreteM3": 13.4,
      "netConcreteM3": 13.4
    }
  },
  "steelByMaterial": {},
  "elements": [
    {
      "id": "S1",
      "occurrence": 0,
      "type": "Slab",
      "story": "L1",
      "materialGroup": "C30",
      "status": "Included",
      "grossConcreteM3": 12.8,
      "netConcreteM3": 12.8,
      "steelKg": null,
      "reinforcementSource": null,
      "steelExact": null,
      "steelComponentsKg": [],
      "grossAreaM2": 64.0,
      "openingAreaSumM2": 0.0,
      "openingDeductedAreaM2": 0.0,
      "netAreaM2": 64.0
    },
    {
      "id": "DP1",
      "occurrence": 0,
      "type": "Slab",
      "story": "L1",
      "materialGroup": "C30",
      "status": "Included",
      "grossConcreteM3": 0.6,
      "netConcreteM3": 0.6,
      "steelKg": null,
      "reinforcementSource": null,
      "steelExact": null,
      "steelComponentsKg": [],
      "grossAreaM2": 4.0,
      "openingAreaSumM2": 0.0,
      "openingDeductedAreaM2": 0.0,
      "netAreaM2": 4.0
    }
  ],
  "warnings": [
    {
      "code": "SLAB_OVERLAP",
      "severity": "Warning",
      "subject": "S1+DP1"
    }
  ],
  "tolerance": {
    "volumeM3": 1e-06,
    "areaM2": 1e-06,
    "lengthM": 1e-06,
    "steelKg": 0.001,
    "relative": 1e-09
  },
  "derivation": {
    "method": "independent_first_principles",
    "generator": "quentra_bench",
    "generatorVersion": "1.1.0",
    "handChecks": 1,
    "closedFormCrossCheck": false
  }
}
