{
  "caseId": "RSRC-007",
  "schemaVersion": "1.0",
  "provenanceType": "synthetic_engineering_benchmark",
  "snapshotStatus": "Accepted",
  "finalization": {
    "allowed": false,
    "blockingCodes": [
      "REINFORCEMENT_SOURCE_MISMATCH"
    ]
  },
  "modelTotals": {
    "grossConcreteM3": 1.08,
    "openingDeductionM3": 0.0,
    "netConcreteM3": 1.08,
    "unclassifiedVolumeM3": 0.0,
    "steelKg": 0.0,
    "steelExactKg": 0.0,
    "steelApproximateKg": 0.0,
    "steelKgBySource": {
      "ProvidedBars": 0.0,
      "RequiredDesignArea": 0.0,
      "EstimatedRatio": 0.0,
      "ManualOverride": 0.0
    }
  },
  "completeness": {
    "concrete": "Complete",
    "steel": "Incomplete",
    "concreteUnknownElementIds": [],
    "steelUnknownElementIds": [
      "B1"
    ]
  },
  "byStory": {
    "L1": {
      "grossConcreteM3": 1.08,
      "netConcreteM3": 1.08,
      "steelKg": 0.0
    }
  },
  "byElementType": {
    "Beam": {
      "grossConcreteM3": 1.08,
      "netConcreteM3": 1.08,
      "steelKg": 0.0
    },
    "Column": {
      "grossConcreteM3": 0.0,
      "netConcreteM3": 0.0,
      "steelKg": 0.0
    },
    "Slab": {
      "grossConcreteM3": 0.0,
      "netConcreteM3": 0.0,
      "steelKg": 0.0
    },
    "Wall": {
      "grossConcreteM3": 0.0,
      "netConcreteM3": 0.0,
      "steelKg": 0.0
    }
  },
  "byMaterial": {
    "C30": {
      "grossConcreteM3": 1.08,
      "netConcreteM3": 1.08
    }
  },
  "steelByMaterial": {},
  "elements": [
    {
      "id": "B1",
      "occurrence": 0,
      "type": "Beam",
      "story": "L1",
      "materialGroup": "C30",
      "status": "Included",
      "grossConcreteM3": 1.08,
      "netConcreteM3": 1.08,
      "steelKg": null,
      "reinforcementSource": "ProvidedBars",
      "steelExact": null,
      "steelComponentsKg": [],
      "lengthM": 6.0
    }
  ],
  "warnings": [
    {
      "code": "REINFORCEMENT_SOURCE_MISMATCH",
      "severity": "Error",
      "subject": "B1"
    }
  ],
  "tolerance": {
    "volumeM3": 1e-06,
    "areaM2": 1e-06,
    "lengthM": 1e-06,
    "steelKg": 0.001,
    "relative": 1e-09
  },
  "derivation": {
    "method": "independent_first_principles",
    "generator": "quentra_bench",
    "generatorVersion": "1.1.0",
    "handChecks": 1,
    "closedFormCrossCheck": false
  }
}
